video_number,inferred_date,inferred_title,video_id,source_vtt_path,cleaned_md_path,word_count,line_count,file_size_bytes,has_transcript,notes
217,2021-07-31,How to profit from order flow trading futures Orderflows Trader 3.0 for NinjaTrader 8,UrUF3cFgdZ8,C:\YTTranscripts\Orderflows_Dedup_v2\20210731 - How to profit from order flow trading futures Orderflows Trader 3.0 for NinjaTrader 8 [UrUF3cFgdZ8].en.vtt,C:\Users\chenk\Desktop\LloydTrading\Reversals\Research\Orderflows_APlus_Reversal_KB_v1\clean_transcripts\0217_20210731_How_to_profit_from_order_flow_trading_futures_Orderflows_Tra_UrUF3cFgdZ8.md,14905,2501,773070,TRUE,
218,2021-08-25,Orderflows Turns Workshop: Supportive Buying & Resistance Selling,lOjK4ZJZNPQ,C:\YTTranscripts\Orderflows_Dedup_v2\20210825 - Orderflows Turns Workshop： Supportive Buying & Resistance Selling [lOjK4ZJZNPQ].en.vtt,C:\Users\chenk\Desktop\LloydTrading\Reversals\Research\Orderflows_APlus_Reversal_KB_v1\clean_transcripts\0218_20210825_Orderflows_Turns_Workshop_Supportive_Buying_Resistance_Selli_lOjK4ZJZNPQ.md,11865,2058,615101,TRUE,
219,2021-08-27,Order Flow Interpretation Trade With More Skill And Consistency,CFkU-0oSRhA,C:\YTTranscripts\Orderflows_Dedup_v2\20210827 - Order Flow Interpretation Trade With More Skill And Consistency [CFkU-0oSRhA].en.vtt,C:\Users\chenk\Desktop\LloydTrading\Reversals\Research\Orderflows_APlus_Reversal_KB_v1\clean_transcripts\0219_20210827_Order_Flow_Interpretation_Trade_With_More_Skill_And_Consiste_CFkU-0oSRhA.md,8496,1372,436445,TRUE,
220,2021-09-24,Part 1 Flowsbounce Workshop Volume Profile Combined With Order Flow,m4gUDC8VtKM,C:\YTTranscripts\Orderflows_Dedup_v2\20210924 - Part 1 Flowsbounce Workshop Volume Profile Combined With Order Flow [m4gUDC8VtKM].en.vtt,C:\Users\chenk\Desktop\LloydTrading\Reversals\Research\Orderflows_APlus_Reversal_KB_v1\clean_transcripts\0220_20210924_Part_1_Flowsbounce_Workshop_Volume_Profile_Combined_With_Ord_m4gUDC8VtKM.md,12330,2089,633692,TRUE,
221,2021-09-24,Part 2 Flowsbounce Workshop Volume Profile Combined With Order Flow,khBcKjRBJI8,C:\YTTranscripts\Orderflows_Dedup_v2\20210924 - Part 2 Flowsbounce Workshop Volume Profile Combined With Order Flow [khBcKjRBJI8].en.vtt,C:\Users\chenk\Desktop\LloydTrading\Reversals\Research\Orderflows_APlus_Reversal_KB_v1\clean_transcripts\0221_20210924_Part_2_Flowsbounce_Workshop_Volume_Profile_Combined_With_Ord_khBcKjRBJI8.md,7371,1343,386250,TRUE,
222,2021-10-07,Get Your Edge In Trading With Order Flow,7EA7__YZWvY,C:\YTTranscripts\Orderflows_Dedup_v2\20211007 - Get Your Edge In Trading With Order Flow [7EA7__YZWvY].en.vtt,C:\Users\chenk\Desktop\LloydTrading\Reversals\Research\Orderflows_APlus_Reversal_KB_v1\clean_transcripts\0222_20211007_Get_Your_Edge_In_Trading_With_Order_Flow_7EA7__YZWvY.md,12639,2031,645427,TRUE,
223,2021-10-27,How To Trade The Evening Session With Order Flow Using Orderflows Delta Scalper for NT8,vT_xHU_t7Qs,C:\YTTranscripts\Orderflows_Dedup_v2\20211027 - How To Trade The Evening Session With Order Flow Using Orderflows Delta Scalper for NT8 [vT_xHU_t7Qs].en.vtt,C:\Users\chenk\Desktop\LloydTrading\Reversals\Research\Orderflows_APlus_Reversal_KB_v1\clean_transcripts\0223_20211027_How_To_Trade_The_Evening_Session_With_Order_Flow_Using_Order_vT_xHU_t7Qs.md,2409,374,121107,TRUE,
224,2021-10-29,Orderflows Delta Scalper Delta Analysis Tool,Eeqb16j8MZ4,C:\YTTranscripts\Orderflows_Dedup_v2\20211029 - Orderflows Delta Scalper   Delta Analysis Tool [Eeqb16j8MZ4].en.vtt,C:\Users\chenk\Desktop\LloydTrading\Reversals\Research\Orderflows_APlus_Reversal_KB_v1\clean_transcripts\0224_20211029_Orderflows_Delta_Scalper_Delta_Analysis_Tool_Eeqb16j8MZ4.md,15795,2614,814875,TRUE,
225,2021-11-12,Part 1 Flowedges Identify Market Moving Order Flow On Plain Charts,Wu7IRwCGMlU,C:\YTTranscripts\Orderflows_Dedup_v2\20211112 - Part 1 Flowedges   Identify Market Moving Order Flow On Plain Charts [Wu7IRwCGMlU].en.vtt,C:\Users\chenk\Desktop\LloydTrading\Reversals\Research\Orderflows_APlus_Reversal_KB_v1\clean_transcripts\0225_20211112_Part_1_Flowedges_Identify_Market_Moving_Order_Flow_On_Plain__Wu7IRwCGMlU.md,9982,1756,516605,TRUE,
226,2021-11-12,Part 2 Q & A Flowedges Training Order Flow Analysis NT8,Uv6uI3v-XRY,C:\YTTranscripts\Orderflows_Dedup_v2\20211112 - Part 2   Q & A Flowedges Training Order Flow Analysis NT8 [Uv6uI3v-XRY].en.vtt,C:\Users\chenk\Desktop\LloydTrading\Reversals\Research\Orderflows_APlus_Reversal_KB_v1\clean_transcripts\0226_20211112_Part_2_Q_A_Flowedges_Training_Order_Flow_Analysis_NT8_Uv6uI3v-XRY.md,5609,998,290055,TRUE,
227,2021-11-16,Flowedges & The Power Of Tick Charts,M4k5jAgJhM4,C:\YTTranscripts\Orderflows_Dedup_v2\20211116 - Flowedges & The Power Of Tick Charts [M4k5jAgJhM4].en.vtt,C:\Users\chenk\Desktop\LloydTrading\Reversals\Research\Orderflows_APlus_Reversal_KB_v1\clean_transcripts\0227_20211116_Flowedges_The_Power_Of_Tick_Charts_M4k5jAgJhM4.md,3829,600,190200,TRUE,
228,2021-12-03,How To Spot Order Flow Trading Opportunities Training,wHWBZkrLP1E,C:\YTTranscripts\Orderflows_Dedup_v2\20211203 - How To Spot Order Flow Trading Opportunities Training [wHWBZkrLP1E].en.vtt,C:\Users\chenk\Desktop\LloydTrading\Reversals\Research\Orderflows_APlus_Reversal_KB_v1\clean_transcripts\0228_20211203_How_To_Spot_Order_Flow_Trading_Opportunities_Training_wHWBZkrLP1E.md,8471,1388,434767,TRUE,
229,2021-12-17,Strategic Order Flow The Pathway To Trading Success,n6s4bYBhNvc,C:\YTTranscripts\Orderflows_Dedup_v2\20211217 - Strategic Order Flow   The Pathway To Trading Success [n6s4bYBhNvc].en.vtt,C:\Users\chenk\Desktop\LloydTrading\Reversals\Research\Orderflows_APlus_Reversal_KB_v1\clean_transcripts\0229_20211217_Strategic_Order_Flow_The_Pathway_To_Trading_Success_n6s4bYBhNvc.md,8558,1341,434763,TRUE,
230,2022-01-28,Strategies For Day Trading Order Flow,c1_62whi8Sg,C:\YTTranscripts\Orderflows_Dedup_v2\20220128 - Strategies For Day Trading Order Flow [c1_62whi8Sg].en.vtt,C:\Users\chenk\Desktop\LloydTrading\Reversals\Research\Orderflows_APlus_Reversal_KB_v1\clean_transcripts\0230_20220128_Strategies_For_Day_Trading_Order_Flow_c1_62whi8Sg.md,7873,1279,403959,TRUE,
231,2022-02-03,Time Versus Tick Based Charts With Orderflows FlowBreaks Indicator,A08hAc5jUkw,C:\YTTranscripts\Orderflows_Dedup_v2\20220203 - Time Versus Tick Based Charts With Orderflows FlowBreaks Indicator [A08hAc5jUkw].en.vtt,C:\Users\chenk\Desktop\LloydTrading\Reversals\Research\Orderflows_APlus_Reversal_KB_v1\clean_transcripts\0231_20220203_Time_Versus_Tick_Based_Charts_With_Orderflows_FlowBreaks_Ind_A08hAc5jUkw.md,4197,675,212482,TRUE,
232,2022-02-08,How To Automate Orderflows Indicators With Markers From The Indicator Store,9kNm7DJsDuU,C:\YTTranscripts\Orderflows_Dedup_v2\20220208 - How To Automate Orderflows Indicators With Markers From The Indicator Store [9kNm7DJsDuU].en.vtt,C:\Users\chenk\Desktop\LloydTrading\Reversals\Research\Orderflows_APlus_Reversal_KB_v1\clean_transcripts\0232_20220208_How_To_Automate_Orderflows_Indicators_With_Markers_From_The__9kNm7DJsDuU.md,9808,1742,510599,TRUE,
233,2022-02-14,Orderflows FlowBreaks Set Up With Markers From The Indicator Store,Mzo2pE5WSTE,C:\YTTranscripts\Orderflows_Dedup_v2\20220214 - Orderflows FlowBreaks Set Up With Markers From The Indicator Store [Mzo2pE5WSTE].en.vtt,C:\Users\chenk\Desktop\LloydTrading\Reversals\Research\Orderflows_APlus_Reversal_KB_v1\clean_transcripts\0233_20220214_Orderflows_FlowBreaks_Set_Up_With_Markers_From_The_Indicator_Mzo2pE5WSTE.md,3167,490,159000,TRUE,
234,2022-02-21,Orderflows Trader 5 0 Introducing New Order Flow Analysis Tools For Your Trading,1jiRoadoeh8,C:\YTTranscripts\Orderflows_Dedup_v2\20220221 - Orderflows Trader 5 0 Introducing New Order Flow Analysis Tools For Your Trading [1jiRoadoeh8].en.vtt,C:\Users\chenk\Desktop\LloydTrading\Reversals\Research\Orderflows_APlus_Reversal_KB_v1\clean_transcripts\0234_20220221_Orderflows_Trader_5_0_Introducing_New_Order_Flow_Analysis_To_1jiRoadoeh8.md,11542,1913,590353,TRUE,
235,2022-02-25,Orderflows Trader 5 0 Trading Value Area Zones With OFT5 0 For NinjaTrader 8,quaZAIapStE,C:\YTTranscripts\Orderflows_Dedup_v2\20220225 - Orderflows Trader 5 0 Trading Value Area Zones With OFT5 0 For NinjaTrader 8 [quaZAIapStE].en.vtt,C:\Users\chenk\Desktop\LloydTrading\Reversals\Research\Orderflows_APlus_Reversal_KB_v1\clean_transcripts\0235_20220225_Orderflows_Trader_5_0_Trading_Value_Area_Zones_With_OFT5_0_F_quaZAIapStE.md,7561,1283,385566,TRUE,
236,2022-03-20,Order Flow Demystified How To Read The Market,RUkmJ7wQp0k,C:\YTTranscripts\Orderflows_Dedup_v2\20220320 - Order Flow Demystified How To Read The Market [RUkmJ7wQp0k].en.vtt,C:\Users\chenk\Desktop\LloydTrading\Reversals\Research\Orderflows_APlus_Reversal_KB_v1\clean_transcripts\0236_20220320_Order_Flow_Demystified_How_To_Read_The_Market_RUkmJ7wQp0k.md,10240,1645,521881,TRUE,
237,2022-03-26,Orderflows Sequencing Indicator For NT8 Order Flow Analysis For Candlestick Charts On NinjaTrader,C6opqFcg1ls,C:\YTTranscripts\Orderflows_Dedup_v2\20220326 - Orderflows Sequencing Indicator For NT8 Order Flow Analysis For Candlestick Charts On NinjaTrader [C6opqFcg1ls].en.vtt,C:\Users\chenk\Desktop\LloydTrading\Reversals\Research\Orderflows_APlus_Reversal_KB_v1\clean_transcripts\0237_20220326_Orderflows_Sequencing_Indicator_For_NT8_Order_Flow_Analysis__C6opqFcg1ls.md,6116,1004,313662,TRUE,
238,2022-03-29,Bitcoin Analysis With Order Flow Footprint Chart,aXn7Qpm5xhE,C:\YTTranscripts\Orderflows_Dedup_v2\20220329 - Bitcoin Analysis With Order Flow Footprint Chart [aXn7Qpm5xhE].en.vtt,C:\Users\chenk\Desktop\LloydTrading\Reversals\Research\Orderflows_APlus_Reversal_KB_v1\clean_transcripts\0238_20220329_Bitcoin_Analysis_With_Order_Flow_Footprint_Chart_aXn7Qpm5xhE.md,2820,446,143104,TRUE,
239,2022-03-29,How To Set Up Orderflows Sequencing In Markers For NinjaTrader 8 Order Flow Trading,03w35Q0a-jI,C:\YTTranscripts\Orderflows_Dedup_v2\20220329 - How To Set Up Orderflows Sequencing In Markers For NinjaTrader 8 Order Flow Trading [03w35Q0a-jI].en.vtt,C:\Users\chenk\Desktop\LloydTrading\Reversals\Research\Orderflows_APlus_Reversal_KB_v1\clean_transcripts\0239_20220329_How_To_Set_Up_Orderflows_Sequencing_In_Markers_For_NinjaTrad_03w35Q0a-jI.md,1848,306,93728,TRUE,
240,2022-03-30,Pros And Cons Of Automated Trading With Orderflows Sequencing For NinjaTrader 8,eCeP9WDwZUI,C:\YTTranscripts\Orderflows_Dedup_v2\20220330 - Pros And Cons Of Automated Trading With Orderflows Sequencing For NinjaTrader 8 [eCeP9WDwZUI].en.vtt,C:\Users\chenk\Desktop\LloydTrading\Reversals\Research\Orderflows_APlus_Reversal_KB_v1\clean_transcripts\0240_20220330_Pros_And_Cons_Of_Automated_Trading_With_Orderflows_Sequencin_eCeP9WDwZUI.md,5270,909,271591,TRUE,
241,2022-04-03,Bitcoin Order Flow Market Analysis March 30 April 2 Using Orderflows Trader 5 0 For NinjaTrader,l4NrytQSSAg,C:\YTTranscripts\Orderflows_Dedup_v2\20220403 - Bitcoin Order Flow Market Analysis March 30   April 2 Using Orderflows Trader 5 0 For NinjaTrader [l4NrytQSSAg].en.vtt,C:\Users\chenk\Desktop\LloydTrading\Reversals\Research\Orderflows_APlus_Reversal_KB_v1\clean_transcripts\0241_20220403_Bitcoin_Order_Flow_Market_Analysis_March_30_April_2_Using_Or_l4NrytQSSAg.md,4367,699,220965,TRUE,
242,2022-04-03,Part 1 Trading with the Order Flow Footprint How to Spot Opportunities in the Market,RNa63__hKSE,C:\YTTranscripts\Orderflows_Dedup_v2\20220403 - Part 1 Trading with the Order Flow Footprint  How to Spot Opportunities in the Market [RNa63__hKSE].en.vtt,C:\Users\chenk\Desktop\LloydTrading\Reversals\Research\Orderflows_APlus_Reversal_KB_v1\clean_transcripts\0242_20220403_Part_1_Trading_with_the_Order_Flow_Footprint_How_to_Spot_Opp_RNa63__hKSE.md,9181,1529,470093,TRUE,
243,2022-04-03,Part 2 Trading with the Order Flow Footprint How to Spot Opportunities in the Market 2,pqBAUgpHYHU,C:\YTTranscripts\Orderflows_Dedup_v2\20220403 - Part 2 Trading with the Order Flow Footprint How to Spot Opportunities in the Market 2 [pqBAUgpHYHU].en.vtt,C:\Users\chenk\Desktop\LloydTrading\Reversals\Research\Orderflows_APlus_Reversal_KB_v1\clean_transcripts\0243_20220403_Part_2_Trading_with_the_Order_Flow_Footprint_How_to_Spot_Opp_pqBAUgpHYHU.md,6458,1137,335499,TRUE,
244,2022-04-07,Order Flow Analysis Inverse Imbalances How To Trade Them With NinjaTrader 8,sUJqWMIigZs,C:\YTTranscripts\Orderflows_Dedup_v2\20220407 - Order Flow Analysis Inverse Imbalances How To Trade Them With NinjaTrader 8 [sUJqWMIigZs].en.vtt,C:\Users\chenk\Desktop\LloydTrading\Reversals\Research\Orderflows_APlus_Reversal_KB_v1\clean_transcripts\0244_20220407_Order_Flow_Analysis_Inverse_Imbalances_How_To_Trade_Them_Wit_sUJqWMIigZs.md,1898,300,95776,TRUE,
245,2022-04-07,What To Look For In The Order Flow On 10 Minute Footprint Charts Using Orderflows Trader,NVCmmdMeMSY,C:\YTTranscripts\Orderflows_Dedup_v2\20220407 - What To Look For In The Order Flow On 10 Minute Footprint Charts Using Orderflows Trader [NVCmmdMeMSY].en.vtt,C:\Users\chenk\Desktop\LloydTrading\Reversals\Research\Orderflows_APlus_Reversal_KB_v1\clean_transcripts\0245_20220407_What_To_Look_For_In_The_Order_Flow_On_10_Minute_Footprint_Ch_NVCmmdMeMSY.md,3703,591,187811,TRUE,
246,2022-04-08,Understanding How Big Orders Trade In The Order Flow Using Orderflows Trader For NinjaTrader 8,zQPoT7th5iI,C:\YTTranscripts\Orderflows_Dedup_v2\20220408 - Understanding How Big Orders Trade In The Order Flow Using Orderflows Trader For NinjaTrader 8 [zQPoT7th5iI].en.vtt,C:\Users\chenk\Desktop\LloydTrading\Reversals\Research\Orderflows_APlus_Reversal_KB_v1\clean_transcripts\0246_20220408_Understanding_How_Big_Orders_Trade_In_The_Order_Flow_Using_O_zQPoT7th5iI.md,2612,402,131315,TRUE,
247,2022-04-12,Trading The Order Flow Delta Footprint Chart With Orderflows Trader 5 For NinjaTrader,BwymfXh9KnI,C:\YTTranscripts\Orderflows_Dedup_v2\20220412 - Trading The Order Flow Delta Footprint Chart With Orderflows Trader 5 For NinjaTrader [BwymfXh9KnI].en.vtt,C:\Users\chenk\Desktop\LloydTrading\Reversals\Research\Orderflows_APlus_Reversal_KB_v1\clean_transcripts\0247_20220412_Trading_The_Order_Flow_Delta_Footprint_Chart_With_Orderflows_BwymfXh9KnI.md,2992,465,150596,TRUE,
248,2022-04-14,"What Did The Delta Scalper Do In MES, GC and 6E",TriUrqJmQCQ,"C:\YTTranscripts\Orderflows_Dedup_v2\20220414 - What Did The Delta Scalper Do In MES, GC and 6E [TriUrqJmQCQ].en.vtt",C:\Users\chenk\Desktop\LloydTrading\Reversals\Research\Orderflows_APlus_Reversal_KB_v1\clean_transcripts\0248_20220414_What_Did_The_Delta_Scalper_Do_In_MES_GC_and_6E_TriUrqJmQCQ.md,2121,336,106318,TRUE,
249,2022-04-19,Order Flow Highlights ES April 18 and 19 2022 NinjaTrader 8 Orderflows Trader 5,UH9B3sTLyHU,C:\YTTranscripts\Orderflows_Dedup_v2\20220419 - Order Flow Highlights ES April 18 and 19 2022 NinjaTrader 8 Orderflows Trader 5 [UH9B3sTLyHU].en.vtt,C:\Users\chenk\Desktop\LloydTrading\Reversals\Research\Orderflows_APlus_Reversal_KB_v1\clean_transcripts\0249_20220419_Order_Flow_Highlights_ES_April_18_and_19_2022_NinjaTrader_8__UH9B3sTLyHU.md,3385,528,170859,TRUE,
250,2022-04-20,How To Set Up Orderflows Delta Scalper With Markers From The Indicator Store,goVqzUgQ-jM,C:\YTTranscripts\Orderflows_Dedup_v2\20220420 - How To Set Up Orderflows Delta Scalper With Markers From The Indicator Store [goVqzUgQ-jM].en.vtt,C:\Users\chenk\Desktop\LloydTrading\Reversals\Research\Orderflows_APlus_Reversal_KB_v1\clean_transcripts\0250_20220420_How_To_Set_Up_Orderflows_Delta_Scalper_With_Markers_From_The_goVqzUgQ-jM.md,1804,260,86903,TRUE,
251,2022-05-09,Advanced Techniques For Trading Order Flow,GP1JaXjyD8k,C:\YTTranscripts\Orderflows_Dedup_v2\20220509 - Advanced Techniques For Trading Order Flow [GP1JaXjyD8k].en.vtt,C:\Users\chenk\Desktop\LloydTrading\Reversals\Research\Orderflows_APlus_Reversal_KB_v1\clean_transcripts\0251_20220509_Advanced_Techniques_For_Trading_Order_Flow_GP1JaXjyD8k.md,9613,1613,497128,TRUE,
252,2022-06-01,Learn advanced order flow techniques to trade like a PRO,bdbSkf2Ahrs,C:\YTTranscripts\Orderflows_Dedup_v2\20220601 - Learn advanced order flow techniques to trade like a PRO [bdbSkf2Ahrs].en.vtt,C:\Users\chenk\Desktop\LloydTrading\Reversals\Research\Orderflows_APlus_Reversal_KB_v1\clean_transcripts\0252_20220601_Learn_advanced_order_flow_techniques_to_trade_like_a_PRO_bdbSkf2Ahrs.md,10145,1647,518190,TRUE,
253,2022-06-16,The Orderflows Flowsmasher Workshop,t7_JsnBSlw4,C:\YTTranscripts\Orderflows_Dedup_v2\20220616 - The Orderflows Flowsmasher Workshop [t7_JsnBSlw4].en.vtt,C:\Users\chenk\Desktop\LloydTrading\Reversals\Research\Orderflows_APlus_Reversal_KB_v1\clean_transcripts\0253_20220616_The_Orderflows_Flowsmasher_Workshop_t7_JsnBSlw4.md,9670,1669,499003,TRUE,
254,2022-07-01,Trading with Order Flow How to Spot Opportunities in the Market,SSS6Qe-QL8U,C:\YTTranscripts\Orderflows_Dedup_v2\20220701 - Trading with Order Flow How to Spot Opportunities in the Market [SSS6Qe-QL8U].en.vtt,C:\Users\chenk\Desktop\LloydTrading\Reversals\Research\Orderflows_APlus_Reversal_KB_v1\clean_transcripts\0254_20220701_Trading_with_Order_Flow_How_to_Spot_Opportunities_in_the_Mar_SSS6Qe-QL8U.md,11881,1962,619623,TRUE,
255,2022-07-22,Professional Trading Strategies Trading The Order Flow,NbP8isuPajs,C:\YTTranscripts\Orderflows_Dedup_v2\20220722 - Professional Trading Strategies Trading The Order Flow [NbP8isuPajs].en.vtt,C:\Users\chenk\Desktop\LloydTrading\Reversals\Research\Orderflows_APlus_Reversal_KB_v1\clean_transcripts\0255_20220722_Professional_Trading_Strategies_Trading_The_Order_Flow_NbP8isuPajs.md,12395,1923,628426,TRUE,
256,2022-08-05,How to Find Hidden Trading Opportunities using Order Flow,hhvs7cYd5SM,C:\YTTranscripts\Orderflows_Dedup_v2\20220805 - How to Find Hidden Trading Opportunities using Order Flow [hhvs7cYd5SM].en.vtt,C:\Users\chenk\Desktop\LloydTrading\Reversals\Research\Orderflows_APlus_Reversal_KB_v1\clean_transcripts\0256_20220805_How_to_Find_Hidden_Trading_Opportunities_using_Order_Flow_hhvs7cYd5SM.md,10506,1705,540364,TRUE,
257,2022-08-12,Orderflows Stratum Analyze Volume Analysis In Value,clnDOBddRj8,C:\YTTranscripts\Orderflows_Dedup_v2\20220812 - Orderflows Stratum Analyze Volume Analysis In Value [clnDOBddRj8].en.vtt,C:\Users\chenk\Desktop\LloydTrading\Reversals\Research\Orderflows_APlus_Reversal_KB_v1\clean_transcripts\0257_20220812_Orderflows_Stratum_Analyze_Volume_Analysis_In_Value_clnDOBddRj8.md,13215,2281,676977,TRUE,
258,2022-08-26,Volume Profile Workshop With Aaron Korbs,X_Jy9vfN4fY,C:\YTTranscripts\Orderflows_Dedup_v2\20220826 - Volume Profile Workshop With Aaron Korbs [X_Jy9vfN4fY].en.vtt,C:\Users\chenk\Desktop\LloydTrading\Reversals\Research\Orderflows_APlus_Reversal_KB_v1\clean_transcripts\0258_20220826_Volume_Profile_Workshop_With_Aaron_Korbs_X_Jy9vfN4fY.md,11925,1852,600158,TRUE,
259,2022-09-01,Order Flow Trading What Happens When You Get Back To Back POCs In A Bar,inPav8Eo130,C:\YTTranscripts\Orderflows_Dedup_v2\20220901 - Order Flow Trading What Happens When You Get Back To Back POCs In A Bar [inPav8Eo130].en.vtt,C:\Users\chenk\Desktop\LloydTrading\Reversals\Research\Orderflows_APlus_Reversal_KB_v1\clean_transcripts\0259_20220901_Order_Flow_Trading_What_Happens_When_You_Get_Back_To_Back_PO_inPav8Eo130.md,842,116,40760,TRUE,
260,2022-09-03,E Mini SP Order Flow Analysis Of Heavy Volume & Initiative Selling,c7xKEoNSuTs,C:\YTTranscripts\Orderflows_Dedup_v2\20220903 - E Mini SP Order Flow Analysis Of Heavy Volume & Initiative Selling [c7xKEoNSuTs].en.vtt,C:\Users\chenk\Desktop\LloydTrading\Reversals\Research\Orderflows_APlus_Reversal_KB_v1\clean_transcripts\0260_20220903_E_Mini_SP_Order_Flow_Analysis_Of_Heavy_Volume_Initiative_Sel_c7xKEoNSuTs.md,3159,489,159004,TRUE,
261,2022-09-03,Stacked Imbalances In The Order Flow Find Low Risk Trades,q3afc_rvvYg,C:\YTTranscripts\Orderflows_Dedup_v2\20220903 - Stacked Imbalances In The Order Flow Find Low Risk Trades [q3afc_rvvYg].en.vtt,C:\Users\chenk\Desktop\LloydTrading\Reversals\Research\Orderflows_APlus_Reversal_KB_v1\clean_transcripts\0261_20220903_Stacked_Imbalances_In_The_Order_Flow_Find_Low_Risk_Trades_q3afc_rvvYg.md,2080,327,105324,TRUE,
262,2022-09-05,Market Imbalances In The Order Flow How To Analyze Order Flow Strategies,-Hy63X5WWCk,C:\YTTranscripts\Orderflows_Dedup_v2\20220905 - Market Imbalances In The Order Flow How To Analyze Order Flow Strategies [-Hy63X5WWCk].en.vtt,C:\Users\chenk\Desktop\LloydTrading\Reversals\Research\Orderflows_APlus_Reversal_KB_v1\clean_transcripts\0262_20220905_Market_Imbalances_In_The_Order_Flow_How_To_Analyze_Order_Flo_-Hy63X5WWCk.md,3443,522,172910,TRUE,
263,2022-09-06,Did Order Flow Delta Foreshadow The Market Sell Off Order Flow Analysis,ym333gXQG0w,C:\YTTranscripts\Orderflows_Dedup_v2\20220906 - Did Order Flow Delta Foreshadow The Market Sell Off Order Flow Analysis [ym333gXQG0w].en.vtt,C:\Users\chenk\Desktop\LloydTrading\Reversals\Research\Orderflows_APlus_Reversal_KB_v1\clean_transcripts\0263_20220906_Did_Order_Flow_Delta_Foreshadow_The_Market_Sell_Off_Order_Fl_ym333gXQG0w.md,1852,275,92596,TRUE,
264,2022-09-06,Does Order Flow Delta Matter Let's Find Out Order Flow Trading Strategies NT8,zUfYAwJ9UC8,C:\YTTranscripts\Orderflows_Dedup_v2\20220906 - Does Order Flow Delta Matter Let's Find Out   Order Flow Trading Strategies NT8 [zUfYAwJ9UC8].en.vtt,C:\Users\chenk\Desktop\LloydTrading\Reversals\Research\Orderflows_APlus_Reversal_KB_v1\clean_transcripts\0264_20220906_Does_Order_Flow_Delta_Matter_Let_s_Find_Out_Order_Flow_Tradi_zUfYAwJ9UC8.md,2576,374,127593,TRUE,
265,2022-09-08,Delta Footprint Chart Gives Traders Great Information When You Know What To Look For,1wOjnQwKgqM,C:\YTTranscripts\Orderflows_Dedup_v2\20220908 - Delta Footprint Chart Gives Traders Great Information When You Know What To Look For [1wOjnQwKgqM].en.vtt,C:\Users\chenk\Desktop\LloydTrading\Reversals\Research\Orderflows_APlus_Reversal_KB_v1\clean_transcripts\0265_20220908_Delta_Footprint_Chart_Gives_Traders_Great_Information_When_Y_1wOjnQwKgqM.md,3433,523,171358,TRUE,
266,2022-09-08,Orderflows & Markers Plus Trading Workshop Automate Order Flow,_zbLa-VsBJU,C:\YTTranscripts\Orderflows_Dedup_v2\20220908 - Orderflows & Markers Plus Trading Workshop Automate Order Flow [_zbLa-VsBJU].en.vtt,C:\Users\chenk\Desktop\LloydTrading\Reversals\Research\Orderflows_APlus_Reversal_KB_v1\clean_transcripts\0266_20220908_Orderflows_Markers_Plus_Trading_Workshop_Automate_Order_Flow__zbLa-VsBJU.md,10599,1640,525594,TRUE,
267,2022-09-10,Order Flow Delta Why Does It Even Mean To Traders Find Patterns To Trade,t2s_-hZ_btY,C:\YTTranscripts\Orderflows_Dedup_v2\20220910 - Order Flow Delta Why Does It Even Mean To Traders Find Patterns To Trade [t2s_-hZ_btY].en.vtt,C:\Users\chenk\Desktop\LloydTrading\Reversals\Research\Orderflows_APlus_Reversal_KB_v1\clean_transcripts\0267_20220910_Order_Flow_Delta_Why_Does_It_Even_Mean_To_Traders_Find_Patte_t2s_-hZ_btY.md,2122,336,107569,TRUE,
268,2022-09-11,How To Trade Using Point of Control POC In The Order Flow,73hHEB2aCRQ,C:\YTTranscripts\Orderflows_Dedup_v2\20220911 - How To Trade Using Point of Control POC In The Order Flow [73hHEB2aCRQ].en.vtt,C:\Users\chenk\Desktop\LloydTrading\Reversals\Research\Orderflows_APlus_Reversal_KB_v1\clean_transcripts\0268_20220911_How_To_Trade_Using_Point_of_Control_POC_In_The_Order_Flow_73hHEB2aCRQ.md,3005,399,144621,TRUE,
269,2022-09-12,Absorption In The Order Flow On Moves Up How To See It In The Delta And Imbalances,n9buSk4fTmg,C:\YTTranscripts\Orderflows_Dedup_v2\20220912 - Absorption In The Order Flow On Moves Up How To See It In The Delta And Imbalances [n9buSk4fTmg].en.vtt,C:\Users\chenk\Desktop\LloydTrading\Reversals\Research\Orderflows_APlus_Reversal_KB_v1\clean_transcripts\0269_20220912_Absorption_In_The_Order_Flow_On_Moves_Up_How_To_See_It_In_Th_n9buSk4fTmg.md,2110,322,105813,TRUE,
270,2022-09-13,Easy Way To Spot A Market Under Strong Selling Pressure With Order Flow,TQOk5IcD9yo,C:\YTTranscripts\Orderflows_Dedup_v2\20220913 - Easy Way To Spot A Market Under Strong Selling Pressure With Order Flow [TQOk5IcD9yo].en.vtt,C:\Users\chenk\Desktop\LloydTrading\Reversals\Research\Orderflows_APlus_Reversal_KB_v1\clean_transcripts\0270_20220913_Easy_Way_To_Spot_A_Market_Under_Strong_Selling_Pressure_With_TQOk5IcD9yo.md,2719,417,135875,TRUE,
271,2022-09-15,Discover New Trading Strategies With Order Flow,_ZDm6q4-YCk,C:\YTTranscripts\Orderflows_Dedup_v2\20220915 - Discover New Trading Strategies With Order Flow [_ZDm6q4-YCk].en.vtt,C:\Users\chenk\Desktop\LloydTrading\Reversals\Research\Orderflows_APlus_Reversal_KB_v1\clean_transcripts\0271_20220915_Discover_New_Trading_Strategies_With_Order_Flow__ZDm6q4-YCk.md,11853,1911,617764,TRUE,
272,2022-09-17,Stopping Volume In Order Flow Use POC To Create A Trading Strategy,toLcsexgGCg,C:\YTTranscripts\Orderflows_Dedup_v2\20220917 - Stopping Volume In Order Flow Use POC To Create A Trading Strategy [toLcsexgGCg].en.vtt,C:\Users\chenk\Desktop\LloydTrading\Reversals\Research\Orderflows_APlus_Reversal_KB_v1\clean_transcripts\0272_20220917_Stopping_Volume_In_Order_Flow_Use_POC_To_Create_A_Trading_St_toLcsexgGCg.md,2510,347,121591,TRUE,
273,2022-09-19,Point Of Control Trading In The Order Flow What To Look For,XQrQbkTOzqk,C:\YTTranscripts\Orderflows_Dedup_v2\20220919 - Point Of Control Trading In The Order Flow What To Look For [XQrQbkTOzqk].en.vtt,C:\Users\chenk\Desktop\LloydTrading\Reversals\Research\Orderflows_APlus_Reversal_KB_v1\clean_transcripts\0273_20220919_Point_Of_Control_Trading_In_The_Order_Flow_What_To_Look_For_XQrQbkTOzqk.md,2643,398,132259,TRUE,
274,2022-09-20,Delta Analysis Point Of Control And Price Action Trading With Order Flow,7qwGYsNPf9o,C:\YTTranscripts\Orderflows_Dedup_v2\20220920 - Delta Analysis Point Of Control And Price Action Trading With Order Flow [7qwGYsNPf9o].en.vtt,C:\Users\chenk\Desktop\LloydTrading\Reversals\Research\Orderflows_APlus_Reversal_KB_v1\clean_transcripts\0274_20220920_Delta_Analysis_Point_Of_Control_And_Price_Action_Trading_Wit_7qwGYsNPf9o.md,3476,496,170758,TRUE,
