video_number,inferred_date,inferred_title,video_id,source_vtt_path,cleaned_md_path,word_count,line_count,file_size_bytes,has_transcript,notes
330,2023-01-25,How A Market Can Rally On Aggressive Selling In Order Flow Footprint Chart Trading Strategy,yIXovXefWWY,C:\YTTranscripts\Orderflows_Dedup_v2\20230125 - How A Market Can Rally On Aggressive Selling In Order Flow Footprint Chart Trading Strategy [yIXovXefWWY].en.vtt,C:\Users\chenk\Desktop\LloydTrading\Reversals\Research\Orderflows_APlus_Reversal_KB_v1\clean_transcripts\0330_20230125_How_A_Market_Can_Rally_On_Aggressive_Selling_In_Order_Flow_F_yIXovXefWWY.md,3216,479,161223,TRUE,
331,2023-01-26,Order Flow Analysis Of A Market Looking To Rally Footprint Trading Strategy,C5tZ3JZWd_4,C:\YTTranscripts\Orderflows_Dedup_v2\20230126 - Order Flow Analysis Of A Market Looking To Rally Footprint Trading Strategy [C5tZ3JZWd_4].en.vtt,C:\Users\chenk\Desktop\LloydTrading\Reversals\Research\Orderflows_APlus_Reversal_KB_v1\clean_transcripts\0331_20230126_Order_Flow_Analysis_Of_A_Market_Looking_To_Rally_Footprint_T_C5tZ3JZWd_4.md,4143,605,203930,TRUE,
332,2023-03-15,Uncover Hidden Market Signs and Opportunities With Order Flow,6XT_Ugqt1Lw,C:\YTTranscripts\Orderflows_Dedup_v2\20230315 - Uncover Hidden Market Signs and Opportunities With Order Flow [6XT_Ugqt1Lw].en.vtt,C:\Users\chenk\Desktop\LloydTrading\Reversals\Research\Orderflows_APlus_Reversal_KB_v1\clean_transcripts\0332_20230315_Uncover_Hidden_Market_Signs_and_Opportunities_With_Order_Flo_6XT_Ugqt1Lw.md,9589,1485,486170,TRUE,
333,2023-04-30,How to Master Order Flow Analysis Think Like An Institutional Trader,V7VMZG0L45E,C:\YTTranscripts\Orderflows_Dedup_v2\20230430 - How to Master Order Flow Analysis Think Like An Institutional Trader [V7VMZG0L45E].en.vtt,C:\Users\chenk\Desktop\LloydTrading\Reversals\Research\Orderflows_APlus_Reversal_KB_v1\clean_transcripts\0333_20230430_How_to_Master_Order_Flow_Analysis_Think_Like_An_Institutiona_V7VMZG0L45E.md,10211,1579,517975,TRUE,
334,2023-06-17,Mastering Order Flow How Traders Can Improve Their Trading Results,4Cj3ZLrp6e0,C:\YTTranscripts\Orderflows_Dedup_v2\20230617 - Mastering Order Flow How Traders Can Improve Their Trading Results [4Cj3ZLrp6e0].en.vtt,C:\Users\chenk\Desktop\LloydTrading\Reversals\Research\Orderflows_APlus_Reversal_KB_v1\clean_transcripts\0334_20230617_Mastering_Order_Flow_How_Traders_Can_Improve_Their_Trading_R_4Cj3ZLrp6e0.md,11271,1809,581662,TRUE,
335,2023-07-01,Orderflows Combo Special Training,_0RY3Ol6SeU,C:\YTTranscripts\Orderflows_Dedup_v2\20230701 - Orderflows Combo Special Training [_0RY3Ol6SeU].en.vtt,C:\Users\chenk\Desktop\LloydTrading\Reversals\Research\Orderflows_APlus_Reversal_KB_v1\clean_transcripts\0335_20230701_Orderflows_Combo_Special_Training__0RY3Ol6SeU.md,14161,2230,707835,TRUE,
336,2023-08-09,Introducing Orderflows Trader On Gocharting A Web Based Footprint Chart,OS1v5o0IU58,C:\YTTranscripts\Orderflows_Dedup_v2\20230809 - Introducing Orderflows Trader On Gocharting A Web Based Footprint Chart [OS1v5o0IU58].en.vtt,C:\Users\chenk\Desktop\LloydTrading\Reversals\Research\Orderflows_APlus_Reversal_KB_v1\clean_transcripts\0336_20230809_Introducing_Orderflows_Trader_On_Gocharting_A_Web_Based_Foot_OS1v5o0IU58.md,3260,502,162373,TRUE,
337,2023-08-10,Order Flow Is Not Just About Trading Areas Of Heavy Volume Orderflows Trader Footprint Chart,8EGxeSYeZ5c,C:\YTTranscripts\Orderflows_Dedup_v2\20230810 - Order Flow Is Not Just About Trading Areas Of Heavy Volume Orderflows Trader Footprint Chart [8EGxeSYeZ5c].en.vtt,C:\Users\chenk\Desktop\LloydTrading\Reversals\Research\Orderflows_APlus_Reversal_KB_v1\clean_transcripts\0337_20230810_Order_Flow_Is_Not_Just_About_Trading_Areas_Of_Heavy_Volume_O_8EGxeSYeZ5c.md,2875,407,140625,TRUE,
338,2023-08-10,Orderflows Trader On GoCharting How To Set Up Orderflows Trader,ANwTB3B9vVM,C:\YTTranscripts\Orderflows_Dedup_v2\20230810 - Orderflows Trader On GoCharting How To Set Up Orderflows Trader [ANwTB3B9vVM].en.vtt,C:\Users\chenk\Desktop\LloydTrading\Reversals\Research\Orderflows_APlus_Reversal_KB_v1\clean_transcripts\0338_20230810_Orderflows_Trader_On_GoCharting_How_To_Set_Up_Orderflows_Tra_ANwTB3B9vVM.md,3187,455,155180,TRUE,
339,2023-08-11,Order Flow Trading Strategy Trade Stacked Imbalances In The Two Way Auction,eqfKeHNGAzo,C:\YTTranscripts\Orderflows_Dedup_v2\20230811 - Order Flow Trading Strategy Trade Stacked Imbalances In The Two Way Auction [eqfKeHNGAzo].en.vtt,C:\Users\chenk\Desktop\LloydTrading\Reversals\Research\Orderflows_APlus_Reversal_KB_v1\clean_transcripts\0339_20230811_Order_Flow_Trading_Strategy_Trade_Stacked_Imbalances_In_The__eqfKeHNGAzo.md,2478,364,123447,TRUE,
340,2023-08-12,Inverse Imbalances In The Order Flow Day Trading Imbalance Strategy,mOPJ_2Mn_hI,C:\YTTranscripts\Orderflows_Dedup_v2\20230812 - Inverse Imbalances In The Order Flow Day Trading Imbalance Strategy [mOPJ_2Mn_hI].en.vtt,C:\Users\chenk\Desktop\LloydTrading\Reversals\Research\Orderflows_APlus_Reversal_KB_v1\clean_transcripts\0340_20230812_Inverse_Imbalances_In_The_Order_Flow_Day_Trading_Imbalance_S_mOPJ_2Mn_hI.md,2391,345,117776,TRUE,
341,2023-08-13,Crypto Order Flow Analysis With Orderflows Trader On GoCharting,F4L45YHx_S8,C:\YTTranscripts\Orderflows_Dedup_v2\20230813 - Crypto Order Flow Analysis With Orderflows Trader On GoCharting [F4L45YHx_S8].en.vtt,C:\Users\chenk\Desktop\LloydTrading\Reversals\Research\Orderflows_APlus_Reversal_KB_v1\clean_transcripts\0341_20230813_Crypto_Order_Flow_Analysis_With_Orderflows_Trader_On_GoChart_F4L45YHx_S8.md,2622,386,129218,TRUE,
342,2023-08-13,Order Flow Trading Strategy Thin Prints In A Bar One Of My Favorite Trade Set Ups,aIA7VoGmdU8,C:\YTTranscripts\Orderflows_Dedup_v2\20230813 - Order Flow Trading Strategy Thin Prints In A Bar One Of My Favorite Trade Set Ups [aIA7VoGmdU8].en.vtt,C:\Users\chenk\Desktop\LloydTrading\Reversals\Research\Orderflows_APlus_Reversal_KB_v1\clean_transcripts\0342_20230813_Order_Flow_Trading_Strategy_Thin_Prints_In_A_Bar_One_Of_My_F_aIA7VoGmdU8.md,2689,390,132532,TRUE,
343,2023-08-14,Trading Thin Volume In The Order Flow Made Easy With Orderflows Trader For NT8,wLyrhhqJ0DM,C:\YTTranscripts\Orderflows_Dedup_v2\20230814 - Trading Thin Volume In The Order Flow Made Easy With Orderflows Trader For NT8 [wLyrhhqJ0DM].en.vtt,C:\Users\chenk\Desktop\LloydTrading\Reversals\Research\Orderflows_APlus_Reversal_KB_v1\clean_transcripts\0343_20230814_Trading_Thin_Volume_In_The_Order_Flow_Made_Easy_With_Orderfl_wLyrhhqJ0DM.md,2560,358,124818,TRUE,
344,2023-08-14,Unlock the Power of Order Flow Trading on GoCharting,Zntiib-4u0E,C:\YTTranscripts\Orderflows_Dedup_v2\20230814 - Unlock the Power of Order Flow Trading on GoCharting [Zntiib-4u0E].en.vtt,C:\Users\chenk\Desktop\LloydTrading\Reversals\Research\Orderflows_APlus_Reversal_KB_v1\clean_transcripts\0344_20230814_Unlock_the_Power_of_Order_Flow_Trading_on_GoCharting_Zntiib-4u0E.md,14142,2233,711241,TRUE,
345,2023-08-16,Order Flow In High Volume Markets What To Look For And Trade Around With Orderflows Trader,0ioZcGuGB9g,C:\YTTranscripts\Orderflows_Dedup_v2\20230816 - Order Flow In High Volume Markets What To Look For And Trade Around With Orderflows Trader [0ioZcGuGB9g].en.vtt,C:\Users\chenk\Desktop\LloydTrading\Reversals\Research\Orderflows_APlus_Reversal_KB_v1\clean_transcripts\0345_20230816_Order_Flow_In_High_Volume_Markets_What_To_Look_For_And_Trade_0ioZcGuGB9g.md,3159,460,155415,TRUE,
346,2023-08-16,Spotting Market Exhaustion In The Order Flow Using Orderflows Trader For NT8,yn365hG60dA,C:\YTTranscripts\Orderflows_Dedup_v2\20230816 - Spotting Market Exhaustion In The Order Flow Using Orderflows Trader For NT8 [yn365hG60dA].en.vtt,C:\Users\chenk\Desktop\LloydTrading\Reversals\Research\Orderflows_APlus_Reversal_KB_v1\clean_transcripts\0346_20230816_Spotting_Market_Exhaustion_In_The_Order_Flow_Using_Orderflow_yn365hG60dA.md,2176,311,106933,TRUE,
347,2023-08-17,Prominent Point Of Controls In The Currency Futures And Forex Market With Orderflows Trader,EtgttoGEovY,C:\YTTranscripts\Orderflows_Dedup_v2\20230817 - Prominent Point Of Controls In The Currency Futures And Forex Market With Orderflows Trader [EtgttoGEovY].en.vtt,C:\Users\chenk\Desktop\LloydTrading\Reversals\Research\Orderflows_APlus_Reversal_KB_v1\clean_transcripts\0347_20230817_Prominent_Point_Of_Controls_In_The_Currency_Futures_And_Fore_EtgttoGEovY.md,3026,448,150070,TRUE,
348,2023-08-18,GoCharting Orderflows Trader Chart Setup,MM2A0rEbnYI,C:\YTTranscripts\Orderflows_Dedup_v2\20230818 - GoCharting Orderflows Trader Chart Setup [MM2A0rEbnYI].en.vtt,C:\Users\chenk\Desktop\LloydTrading\Reversals\Research\Orderflows_APlus_Reversal_KB_v1\clean_transcripts\0348_20230818_GoCharting_Orderflows_Trader_Chart_Setup_MM2A0rEbnYI.md,3625,544,178936,TRUE,
349,2023-08-18,Signs In The Delta The Market Is About To Make A Move Using Orderflows Trader On Ninjatrader 8,-z2hhoCNpAg,C:\YTTranscripts\Orderflows_Dedup_v2\20230818 - Signs In The Delta The Market Is About To Make A Move Using Orderflows Trader On Ninjatrader 8 [-z2hhoCNpAg].en.vtt,C:\Users\chenk\Desktop\LloydTrading\Reversals\Research\Orderflows_APlus_Reversal_KB_v1\clean_transcripts\0349_20230818_Signs_In_The_Delta_The_Market_Is_About_To_Make_A_Move_Using__-z2hhoCNpAg.md,3060,415,147238,TRUE,
350,2023-08-20,Decode Delta Into Volume Values To Develop An Order Flow Footprint Trading Strategy,LycAHMTZY-Q,C:\YTTranscripts\Orderflows_Dedup_v2\20230820 - Decode Delta Into Volume Values To Develop An Order Flow Footprint Trading Strategy [LycAHMTZY-Q].en.vtt,C:\Users\chenk\Desktop\LloydTrading\Reversals\Research\Orderflows_APlus_Reversal_KB_v1\clean_transcripts\0350_20230820_Decode_Delta_Into_Volume_Values_To_Develop_An_Order_Flow_Foo_LycAHMTZY-Q.md,3239,476,159933,TRUE,
351,2023-08-21,Does It Take A Decade To Learn Order Flow Not With Orderflows Trader Fast Track Your Trading,T3sjlJnVpuc,C:\YTTranscripts\Orderflows_Dedup_v2\20230821 - Does It Take A Decade To Learn Order Flow Not With Orderflows Trader Fast Track Your Trading [T3sjlJnVpuc].en.vtt,C:\Users\chenk\Desktop\LloydTrading\Reversals\Research\Orderflows_APlus_Reversal_KB_v1\clean_transcripts\0351_20230821_Does_It_Take_A_Decade_To_Learn_Order_Flow_Not_With_Orderflow_T3sjlJnVpuc.md,3549,493,172184,TRUE,
352,2023-08-21,The Importance Of Order Flow Delta At The High Of Day Trading Market Context,uzcR9Qu8rzQ,C:\YTTranscripts\Orderflows_Dedup_v2\20230821 - The Importance Of Order Flow Delta At The High Of Day Trading Market Context [uzcR9Qu8rzQ].en.vtt,C:\Users\chenk\Desktop\LloydTrading\Reversals\Research\Orderflows_APlus_Reversal_KB_v1\clean_transcripts\0352_20230821_The_Importance_Of_Order_Flow_Delta_At_The_High_Of_Day_Tradin_uzcR9Qu8rzQ.md,2678,384,132029,TRUE,
353,2023-08-22,Order Flow Footprint Chart Vs Plain Candlestick Chart Trading,pe1vqYZkB_s,C:\YTTranscripts\Orderflows_Dedup_v2\20230822 - Order Flow Footprint Chart Vs Plain Candlestick Chart Trading [pe1vqYZkB_s].en.vtt,C:\Users\chenk\Desktop\LloydTrading\Reversals\Research\Orderflows_APlus_Reversal_KB_v1\clean_transcripts\0353_20230822_Order_Flow_Footprint_Chart_Vs_Plain_Candlestick_Chart_Tradin_pe1vqYZkB_s.md,2586,378,128409,TRUE,
354,2023-08-22,Order Flow With VWAP And Technical Patterns Double Bottoms Price Action,kgrciWyVpbA,C:\YTTranscripts\Orderflows_Dedup_v2\20230822 - Order Flow With VWAP And Technical Patterns Double Bottoms Price Action [kgrciWyVpbA].en.vtt,C:\Users\chenk\Desktop\LloydTrading\Reversals\Research\Orderflows_APlus_Reversal_KB_v1\clean_transcripts\0354_20230822_Order_Flow_With_VWAP_And_Technical_Patterns_Double_Bottoms_P_kgrciWyVpbA.md,3351,505,166636,TRUE,
355,2023-08-23,Trading Value Areas With Order Flow Tips On What To Look For Using Orderflows Trader,vfckYm8W2xI,C:\YTTranscripts\Orderflows_Dedup_v2\20230823 - Trading Value Areas With Order Flow Tips On What To Look For Using Orderflows Trader [vfckYm8W2xI].en.vtt,C:\Users\chenk\Desktop\LloydTrading\Reversals\Research\Orderflows_APlus_Reversal_KB_v1\clean_transcripts\0355_20230823_Trading_Value_Areas_With_Order_Flow_Tips_On_What_To_Look_For_vfckYm8W2xI.md,2538,368,125423,TRUE,
356,2023-08-24,Bearish Order Flow On A Trend Day Down Using Orderflows Trader,uybQxpaNWus,C:\YTTranscripts\Orderflows_Dedup_v2\20230824 - Bearish Order Flow On A Trend Day Down Using Orderflows Trader [uybQxpaNWus].en.vtt,C:\Users\chenk\Desktop\LloydTrading\Reversals\Research\Orderflows_APlus_Reversal_KB_v1\clean_transcripts\0356_20230824_Bearish_Order_Flow_On_A_Trend_Day_Down_Using_Orderflows_Trad_uybQxpaNWus.md,3724,537,182991,TRUE,
357,2023-08-25,Identifying Big Buyers Coming Into The Market With Order Flow Using Orderflows Trader Software,Q4ioc1erDEA,C:\YTTranscripts\Orderflows_Dedup_v2\20230825 - Identifying Big Buyers Coming Into The Market With Order Flow Using Orderflows Trader Software [Q4ioc1erDEA].en.vtt,C:\Users\chenk\Desktop\LloydTrading\Reversals\Research\Orderflows_APlus_Reversal_KB_v1\clean_transcripts\0357_20230825_Identifying_Big_Buyers_Coming_Into_The_Market_With_Order_Flo_Q4ioc1erDEA.md,2961,417,144110,TRUE,
358,2023-08-26,Exhaustion Prints In The Order Flow How To Recognize Them Using Orderflows Trader,FxGuMLgTh-w,C:\YTTranscripts\Orderflows_Dedup_v2\20230826 - Exhaustion Prints In The Order Flow How To Recognize Them Using Orderflows Trader [FxGuMLgTh-w].en.vtt,C:\Users\chenk\Desktop\LloydTrading\Reversals\Research\Orderflows_APlus_Reversal_KB_v1\clean_transcripts\0358_20230826_Exhaustion_Prints_In_The_Order_Flow_How_To_Recognize_Them_Us_FxGuMLgTh-w.md,2173,321,106796,TRUE,
359,2023-08-26,NQ vs ES Order Flow Which Is Better For Trading Using Orderflows Trader,xDYRdoiMxzc,C:\YTTranscripts\Orderflows_Dedup_v2\20230826 - NQ vs  ES Order Flow Which Is Better For Trading Using Orderflows Trader [xDYRdoiMxzc].en.vtt,C:\Users\chenk\Desktop\LloydTrading\Reversals\Research\Orderflows_APlus_Reversal_KB_v1\clean_transcripts\0359_20230826_NQ_vs_ES_Order_Flow_Which_Is_Better_For_Trading_Using_Orderf_xDYRdoiMxzc.md,2643,380,129317,TRUE,
360,2023-08-26,Value Area Analysis In Order Flow Using Orderflows Trader,oHlkAVH56cI,C:\YTTranscripts\Orderflows_Dedup_v2\20230826 - Value Area Analysis In Order Flow Using Orderflows Trader [oHlkAVH56cI].en.vtt,C:\Users\chenk\Desktop\LloydTrading\Reversals\Research\Orderflows_APlus_Reversal_KB_v1\clean_transcripts\0360_20230826_Value_Area_Analysis_In_Order_Flow_Using_Orderflows_Trader_oHlkAVH56cI.md,2185,326,108340,TRUE,
361,2023-08-27,GoCharting Prominent Point Of Control POC Screen Settings,CBiBvsdoHOc,C:\YTTranscripts\Orderflows_Dedup_v2\20230827 - GoCharting Prominent Point Of Control POC Screen Settings [CBiBvsdoHOc].en.vtt,C:\Users\chenk\Desktop\LloydTrading\Reversals\Research\Orderflows_APlus_Reversal_KB_v1\clean_transcripts\0361_20230827_GoCharting_Prominent_Point_Of_Control_POC_Screen_Settings_CBiBvsdoHOc.md,1162,163,56519,TRUE,
362,2023-08-27,Order Flow Range Based Charts Versus Time Based Charts Using Orderflows Trader,1Ydve7LY2L8,C:\YTTranscripts\Orderflows_Dedup_v2\20230827 - Order Flow Range Based Charts Versus Time Based Charts Using Orderflows Trader [1Ydve7LY2L8].en.vtt,C:\Users\chenk\Desktop\LloydTrading\Reversals\Research\Orderflows_APlus_Reversal_KB_v1\clean_transcripts\0362_20230827_Order_Flow_Range_Based_Charts_Versus_Time_Based_Charts_Using_1Ydve7LY2L8.md,3165,462,156270,TRUE,
363,2023-08-28,Trading Order Flow Imbalances What Differences Do They Make With Different Levels,8nCYEt87Tuo,C:\YTTranscripts\Orderflows_Dedup_v2\20230828 - Trading Order Flow Imbalances What Differences Do They Make With Different Levels [8nCYEt87Tuo].en.vtt,C:\Users\chenk\Desktop\LloydTrading\Reversals\Research\Orderflows_APlus_Reversal_KB_v1\clean_transcripts\0363_20230828_Trading_Order_Flow_Imbalances_What_Differences_Do_They_Make__8nCYEt87Tuo.md,2859,436,143167,TRUE,
364,2023-08-29,All About Delta Footprint Charts Using Orderflows Trader,N7WDVaRhmPU,C:\YTTranscripts\Orderflows_Dedup_v2\20230829 - All About Delta Footprint Charts Using Orderflows Trader [N7WDVaRhmPU].en.vtt,C:\Users\chenk\Desktop\LloydTrading\Reversals\Research\Orderflows_APlus_Reversal_KB_v1\clean_transcripts\0364_20230829_All_About_Delta_Footprint_Charts_Using_Orderflows_Trader_N7WDVaRhmPU.md,2996,436,147874,TRUE,
365,2023-08-29,Extreme Point Of Control In Order Flow Analysis Develop A Trading Strategy With Orderflows,CY_uPkcPQuU,C:\YTTranscripts\Orderflows_Dedup_v2\20230829 - Extreme Point Of Control In Order Flow Analysis Develop A Trading Strategy With Orderflows [CY_uPkcPQuU].en.vtt,C:\Users\chenk\Desktop\LloydTrading\Reversals\Research\Orderflows_APlus_Reversal_KB_v1\clean_transcripts\0365_20230829_Extreme_Point_Of_Control_In_Order_Flow_Analysis_Develop_A_Tr_CY_uPkcPQuU.md,3108,442,150951,TRUE,
366,2023-08-29,The Ultimate Pro Pattern Bundle From Ninjacators For NinjaTrader 8,nfhyHqVrRfk,C:\YTTranscripts\Orderflows_Dedup_v2\20230829 - The Ultimate Pro Pattern Bundle From Ninjacators For NinjaTrader 8 [nfhyHqVrRfk].en.vtt,C:\Users\chenk\Desktop\LloydTrading\Reversals\Research\Orderflows_APlus_Reversal_KB_v1\clean_transcripts\0366_20230829_The_Ultimate_Pro_Pattern_Bundle_From_Ninjacators_For_NinjaTr_nfhyHqVrRfk.md,2363,349,116384,TRUE,
367,2023-08-30,Market Exhaustion - My Favorite Easiest Trade Setup In Order Flow Footprint Using Orderflows Trader,vCeSd0xc3RU,C:\YTTranscripts\Orderflows_Dedup_v2\20230830 - Market Exhaustion - My Favorite Easiest Trade Setup In Order Flow Footprint Using Orderflows Trader [vCeSd0xc3RU].en.vtt,C:\Users\chenk\Desktop\LloydTrading\Reversals\Research\Orderflows_APlus_Reversal_KB_v1\clean_transcripts\0367_20230830_Market_Exhaustion_My_Favorite_Easiest_Trade_Setup_In_Order_F_vCeSd0xc3RU.md,2836,411,139258,TRUE,
368,2023-08-31,An Unlucky Trade Is There Luck In Trading Order Flow Analysis With Orderflows Trader,PUYcr3SFT5s,C:\YTTranscripts\Orderflows_Dedup_v2\20230831 - An Unlucky Trade  Is There Luck In Trading Order Flow Analysis With Orderflows Trader [PUYcr3SFT5s].en.vtt,C:\Users\chenk\Desktop\LloydTrading\Reversals\Research\Orderflows_APlus_Reversal_KB_v1\clean_transcripts\0368_20230831_An_Unlucky_Trade_Is_There_Luck_In_Trading_Order_Flow_Analysi_PUYcr3SFT5s.md,2209,307,106847,TRUE,
369,2023-08-31,Finding Your Best Chart For Trading Range Charts Or Time Charts,BWqeVdV8FDA,C:\YTTranscripts\Orderflows_Dedup_v2\20230831 - Finding Your Best Chart For Trading Range Charts Or Time Charts [BWqeVdV8FDA].en.vtt,C:\Users\chenk\Desktop\LloydTrading\Reversals\Research\Orderflows_APlus_Reversal_KB_v1\clean_transcripts\0369_20230831_Finding_Your_Best_Chart_For_Trading_Range_Charts_Or_Time_Cha_BWqeVdV8FDA.md,2613,356,126197,TRUE,
370,2023-09-01,Max And Min Delta How To Use It And What It Means In The Order Flow,P-dmxnxnSWw,C:\YTTranscripts\Orderflows_Dedup_v2\20230901 - Max And Min Delta How To Use It And What It Means In The Order Flow [P-dmxnxnSWw].en.vtt,C:\Users\chenk\Desktop\LloydTrading\Reversals\Research\Orderflows_APlus_Reversal_KB_v1\clean_transcripts\0370_20230901_Max_And_Min_Delta_How_To_Use_It_And_What_It_Means_In_The_Ord_P-dmxnxnSWw.md,2595,382,128569,TRUE,
371,2023-09-02,Delta Weakness What It Means To Traders In The Order Flow,8EDtKhr0IK8,C:\YTTranscripts\Orderflows_Dedup_v2\20230902 - Delta Weakness What It Means To Traders In The Order Flow [8EDtKhr0IK8].en.vtt,C:\Users\chenk\Desktop\LloydTrading\Reversals\Research\Orderflows_APlus_Reversal_KB_v1\clean_transcripts\0371_20230902_Delta_Weakness_What_It_Means_To_Traders_In_The_Order_Flow_8EDtKhr0IK8.md,2178,322,107346,TRUE,
372,2023-09-04,How To Use Orderflows Ratios Stopping Volume And Price Exhaustion Explained,h94oCwcw1pc,C:\YTTranscripts\Orderflows_Dedup_v2\20230904 - How To Use Orderflows Ratios Stopping Volume And Price Exhaustion Explained [h94oCwcw1pc].en.vtt,C:\Users\chenk\Desktop\LloydTrading\Reversals\Research\Orderflows_APlus_Reversal_KB_v1\clean_transcripts\0372_20230904_How_To_Use_Orderflows_Ratios_Stopping_Volume_And_Price_Exhau_h94oCwcw1pc.md,3760,549,184331,TRUE,
373,2023-09-05,Delta Flips In The Order Flow And How To Effectively Trade Them,joeKfXcrfK0,C:\YTTranscripts\Orderflows_Dedup_v2\20230905 - Delta Flips In The Order Flow And How To Effectively Trade Them [joeKfXcrfK0].en.vtt,C:\Users\chenk\Desktop\LloydTrading\Reversals\Research\Orderflows_APlus_Reversal_KB_v1\clean_transcripts\0373_20230905_Delta_Flips_In_The_Order_Flow_And_How_To_Effectively_Trade_T_joeKfXcrfK0.md,3312,490,163148,TRUE,
374,2023-09-05,Free Order Flow Trading Course For Gocharting Platform,BrDdorupUuA,C:\YTTranscripts\Orderflows_Dedup_v2\20230905 - Free Order Flow Trading Course For Gocharting Platform [BrDdorupUuA].en.vtt,C:\Users\chenk\Desktop\LloydTrading\Reversals\Research\Orderflows_APlus_Reversal_KB_v1\clean_transcripts\0374_20230905_Free_Order_Flow_Trading_Course_For_Gocharting_Platform_BrDdorupUuA.md,1838,279,91817,TRUE,
375,2023-09-06,Delta Reversals In The Order Flow How To Identify Reversal Points In The Order Flow Delta Candles,Q9Mxr8RNlFQ,C:\YTTranscripts\Orderflows_Dedup_v2\20230906 - Delta Reversals In The Order Flow How To Identify Reversal Points In The Order Flow Delta Candles [Q9Mxr8RNlFQ].en.vtt,C:\Users\chenk\Desktop\LloydTrading\Reversals\Research\Orderflows_APlus_Reversal_KB_v1\clean_transcripts\0375_20230906_Delta_Reversals_In_The_Order_Flow_How_To_Identify_Reversal_P_Q9Mxr8RNlFQ.md,3904,579,191295,TRUE,
376,2023-09-07,Delta Weakness And The Importance Of Order Flow Delta Using Orderflows Trader,18knX6_U2sM,C:\YTTranscripts\Orderflows_Dedup_v2\20230907 - Delta Weakness And The Importance Of Order Flow Delta Using Orderflows Trader [18knX6_U2sM].en.vtt,C:\Users\chenk\Desktop\LloydTrading\Reversals\Research\Orderflows_APlus_Reversal_KB_v1\clean_transcripts\0376_20230907_Delta_Weakness_And_The_Importance_Of_Order_Flow_Delta_Using__18knX6_U2sM.md,1984,285,97309,TRUE,
377,2023-09-07,Think Like An Institutional Trader To Understand What The Big Trades In The Market Really Mean,c_qKFQyxBTA,C:\YTTranscripts\Orderflows_Dedup_v2\20230907 - Think Like An Institutional Trader To Understand What The Big Trades In The Market Really Mean [c_qKFQyxBTA].en.vtt,C:\Users\chenk\Desktop\LloydTrading\Reversals\Research\Orderflows_APlus_Reversal_KB_v1\clean_transcripts\0377_20230907_Think_Like_An_Institutional_Trader_To_Understand_What_The_Bi_c_qKFQyxBTA.md,3543,521,173717,TRUE,
378,2023-09-08,What Is The Ideal Chart For Trading Order Flow,M5iUCMWELsM,C:\YTTranscripts\Orderflows_Dedup_v2\20230908 - What Is The Ideal Chart For Trading Order Flow [M5iUCMWELsM].en.vtt,C:\Users\chenk\Desktop\LloydTrading\Reversals\Research\Orderflows_APlus_Reversal_KB_v1\clean_transcripts\0378_20230908_What_Is_The_Ideal_Chart_For_Trading_Order_Flow_M5iUCMWELsM.md,3435,570,176769,TRUE,
379,2023-09-09,Orderflows Trader vs NinjaTrader Volumetric Charts What Are The Differences,iDXAA6hUt2M,C:\YTTranscripts\Orderflows_Dedup_v2\20230909 - Orderflows Trader vs NinjaTrader Volumetric Charts What Are The Differences [iDXAA6hUt2M].en.vtt,C:\Users\chenk\Desktop\LloydTrading\Reversals\Research\Orderflows_APlus_Reversal_KB_v1\clean_transcripts\0379_20230909_Orderflows_Trader_vs_NinjaTrader_Volumetric_Charts_What_Are__iDXAA6hUt2M.md,4128,673,210029,TRUE,
380,2023-09-10,NinjaTrader Volumetric Charts Point Of Control And Cumulative Delta Candles,PKleRE9dQf0,C:\YTTranscripts\Orderflows_Dedup_v2\20230910 - NinjaTrader Volumetric Charts Point Of Control And Cumulative Delta Candles [PKleRE9dQf0].en.vtt,C:\Users\chenk\Desktop\LloydTrading\Reversals\Research\Orderflows_APlus_Reversal_KB_v1\clean_transcripts\0380_20230910_NinjaTrader_Volumetric_Charts_Point_Of_Control_And_Cumulativ_PKleRE9dQf0.md,2306,343,113722,TRUE,
381,2023-09-10,Trading Without Volume Footprint Charts Like ICT Or Using Orderflows Trader,uzluA2r4NZA,C:\YTTranscripts\Orderflows_Dedup_v2\20230910 - Trading Without Volume Footprint Charts Like ICT Or Using Orderflows Trader [uzluA2r4NZA].en.vtt,C:\Users\chenk\Desktop\LloydTrading\Reversals\Research\Orderflows_APlus_Reversal_KB_v1\clean_transcripts\0381_20230910_Trading_Without_Volume_Footprint_Charts_Like_ICT_Or_Using_Or_uzluA2r4NZA.md,2825,391,137278,TRUE,
382,2023-09-11,Aggressive Buyers Aggressive Sellers Passive Buyers Passive Sellers In The Order Flow,wjuGwun7U4Q,C:\YTTranscripts\Orderflows_Dedup_v2\20230911 - Aggressive Buyers Aggressive Sellers Passive Buyers Passive Sellers In The Order Flow [wjuGwun7U4Q].en.vtt,C:\Users\chenk\Desktop\LloydTrading\Reversals\Research\Orderflows_APlus_Reversal_KB_v1\clean_transcripts\0382_20230911_Aggressive_Buyers_Aggressive_Sellers_Passive_Buyers_Passive__wjuGwun7U4Q.md,2946,436,146914,TRUE,
383,2023-09-12,Identifying Iceberg Orders In The Order Flow Depth Of Market,bbw30l4Wn1c,C:\YTTranscripts\Orderflows_Dedup_v2\20230912 - Identifying Iceberg Orders In The Order Flow Depth Of Market [bbw30l4Wn1c].en.vtt,C:\Users\chenk\Desktop\LloydTrading\Reversals\Research\Orderflows_APlus_Reversal_KB_v1\clean_transcripts\0383_20230912_Identifying_Iceberg_Orders_In_The_Order_Flow_Depth_Of_Market_bbw30l4Wn1c.md,3629,527,178716,TRUE,
384,2023-09-14,Order Flow Value Areas And How To Trade Them Orderflows Trader,u5YH9nT8jtI,C:\YTTranscripts\Orderflows_Dedup_v2\20230914 - Order Flow Value Areas And How To Trade Them Orderflows Trader [u5YH9nT8jtI].en.vtt,C:\Users\chenk\Desktop\LloydTrading\Reversals\Research\Orderflows_APlus_Reversal_KB_v1\clean_transcripts\0384_20230914_Order_Flow_Value_Areas_And_How_To_Trade_Them_Orderflows_Trad_u5YH9nT8jtI.md,3406,482,165222,TRUE,
385,2023-09-15,Pitfalls Of Order Flow Delta Analysis That Traders Make,uJQ469Z5bQ8,C:\YTTranscripts\Orderflows_Dedup_v2\20230915 - Pitfalls Of Order Flow Delta Analysis That Traders Make [uJQ469Z5bQ8].en.vtt,C:\Users\chenk\Desktop\LloydTrading\Reversals\Research\Orderflows_APlus_Reversal_KB_v1\clean_transcripts\0385_20230915_Pitfalls_Of_Order_Flow_Delta_Analysis_That_Traders_Make_uJQ469Z5bQ8.md,3697,506,178678,TRUE,
